{
  "$schema": "http://json-schema.org/draft-07/schema#",
  "$id": "https://raw.githubusercontent.com/RebelliousSmile/schema-in-the-mist/v1.3.2/schemas/v1/otherscape/loadout-item.schema.json",
  "type": "object",
  "properties": {
    "name": {
      "default": "Untitled Loadout Item",
      "description": "The item's name, as printed at the head of its Street Catalog entry. The same string is also the first entry of `feature_tags`, which is how the catalog prints it; both hold it, because one is the record's title and the other is a tag that gets invoked in play.",
      "examples": [
        "Kestrel Whisperlink",
        "Sable-9 Sidearm",
        "Ghost Rig"
      ],
      "type": "string",
      "minLength": 1,
      "pattern": "\\S"
    },
    "category": {
      "description": "The Street Catalog rubric this item is filed under. Kept a free string rather than a closed set: the thirteen rubrics of one catalog look closed enough to enumerate, and that is the trap — each setting book prints its own catalog under its own headings, and homebrew rubrics stay expressible only if nothing here forbids them. Same house rule, same reason as `category` on an :Otherscape Theme Kit, though the two hold unrelated things: that one names a themebook.",
      "examples": [
        "Weapons",
        "Armor",
        "Cybernetics",
        "Drones",
        "Source-Touched Items",
        "Vehicles"
      ],
      "type": "string"
    },
    "description": {
      "description": "The prose the catalog prints for this item: what it is and what carrying it says about you. Supports inline Markdown; use `\\n\\n` for paragraph breaks.",
      "examples": [
        "A throat-mounted relay that turns a whisper into a clean signal three blocks out."
      ],
      "type": "string"
    },
    "feature_tags": {
      "description": "The tags this item grants, in the order the catalog prints them. **The first entry is the item's own name**, which is the catalog's convention — the same one a Theme Kit follows with its title tag. Unlike a Theme Kit, it is not lifted into a field of its own: on a kit the title tag is a distinct game object that a played Theme carries separately, whereas here it is only a naming convention inside this list, and a separate field would have nothing on the other side to receive it. Read `name` when the title is what is wanted.",
      "type": "array",
      "items": {
        "type": "string",
        "minLength": 1,
        "pattern": "\\S",
        "description": "One tag this item grants, which its bearer invokes to be Favored. Written without the surrounding braces of the inline tag syntax; a renderer adds them.",
        "examples": [
          "Kestrel Whisperlink",
          "hard to jam"
        ]
      }
    },
    "weakness_tag": {
      "description": "The one tag this item turns against its bearer, which the MC invokes to Imperil them. A single string rather than an array, because the catalog prints exactly one per specific item: an array would invite producers to write two and consumers to handle a case the rules do not have. Optional, because a few catalog entries print none. Written without the surrounding braces and without the leading marker of the inline weakness syntax.",
      "examples": [
        "only as quiet as the room",
        "runs hot"
      ],
      "type": "string"
    },
    "meta": {
      "description": "Attribution and cataloging fields for the Loadout Item's origin.",
      "type": "object",
      "properties": {
        "publication_type": {
          "default": "homebrew",
          "description": "Classifies the Loadout Item's source to aid cataloging and tooling.",
          "examples": [
            "official",
            "homebrew"
          ],
          "type": "string",
          "enum": [
            "official",
            "third_party",
            "cauldron",
            "homebrew"
          ]
        },
        "source": {
          "description": "Source title (book, supplement, PDF) where this Loadout Item appears.",
          "examples": [
            "Metro:Otherscape - Core Book",
            "Tokyo:Otherscape - Setting Book"
          ],
          "type": "string"
        },
        "authors": {
          "description": "List of credited authors or contributors.",
          "type": "array",
          "items": {
            "type": "string",
            "minLength": 1,
            "pattern": "\\S",
            "description": "One credited author name.",
            "examples": [
              "Son of Oak",
              "4rtamis"
            ]
          }
        },
        "page": {
          "description": "Page number (if relevant to the source).",
          "examples": [
            212,
            226
          ],
          "type": "integer",
          "minimum": 1,
          "maximum": 9007199254740991
        }
      },
      "additionalProperties": false
    }
  },
  "additionalProperties": false,
  "description": ":Otherscape - Loadout Item, one specific item of the Street Catalog: its name, the rubric it is filed under, its prose, the tags it grants and the one tag it turns against its bearer. It models the catalog's specific items only. The general-items blocks — three lists of suggestion words hanging off a rubric — are deliberately left out: they are a lookup table rather than a record, and would be their own target with its own design discussion. Note also that these records are not what a Character Trope's `loadout` strings refer to: that field transcribes a printed line in the trope's own words and resolves against nothing."
}
